<?xml version="1.0" encoding="UTF-8"?>
<!DOCTYPE rutas SYSTEM "rutas.dtd">
<rutas provincia="La Coruña">

  <!-- ============================================================
       RUTA 1: Ruta de la Torre de Hércules y la Costa Atlántica
       ============================================================ -->
  <ruta id="ruta001">
    <nombre>Ruta de la Torre de Hércules y la Costa Atlántica</nombre>
    <tipo>Paisajística</tipo>
    <transporte>A pie</transporte>
    <fechaInicio opcional="si">2025-06-15</fechaInicio>
    <horaInicio opcional="si">09:00</horaInicio>
    <duracion>3 horas</duracion>
    <agencia>CoruñaTur</agencia>
    <descripcion>
      Recorrido a pie por el litoral norte de La Coruña desde la Torre de Hércules,
      faro romano Patrimonio de la Humanidad, hasta las playas del Orzán y Riazor,
      pasando por el Parque de Santa Margarita. Una ruta que combina historia,
      naturaleza y espectaculares vistas al Océano Atlántico.
    </descripcion>
    <personas>Apta para familias con niños y personas de tercera edad</personas>
    <lugarInicio>Torre de Hércules</lugarInicio>
    <direccionInicio>Avenida de Navarra s/n, La Coruña</direccionInicio>
    <coordenadasInicio>
      <longitud>-8.4033</longitud>
      <latitud>43.3860</latitud>
      <altitud>57</altitud>
    </coordenadasInicio>
    <referencias>
      <referencia>https://turismocoruna.com/torre-de-hercules/</referencia>
      <referencia>https://es.wikipedia.org/wiki/Torre_de_H%C3%A9rcules</referencia>
      <referencia>https://whc.unesco.org/en/list/1312</referencia>
    </referencias>
    <recomendacion>9</recomendacion>
    <planimetria archivo="ruta001_planimetria.kml"/>
    <altimetria archivo="ruta001_altimetria.svg"/>
    <hitos>

      <hito orden="1">
        <nombre>Torre de Hércules</nombre>
        <descripcion>
          Faro romano del siglo II d.C., único en el mundo en activo, declarado
          Patrimonio de la Humanidad por la UNESCO en 2009. Desde su cima se
          obtienen vistas panorámicas de la ría y del océano.
        </descripcion>
        <coordenadas>
          <longitud>-8.4033</longitud>
          <latitud>43.3860</latitud>
          <altitud>57</altitud>
        </coordenadas>
        <distanciaDesdeAnterior unidades="m">0</distanciaDesdeAnterior>
        <fotos>
          <foto>torre_de_hercules.jpg</foto>
        </fotos>
      </hito>

      <hito orden="2">
        <nombre>Parque Escultórico de la Torre de Hércules</nombre>
        <descripcion>
          Conjunto de esculturas al aire libre que rodean la Torre, entre las que
          destacan la Rosa de los Vientos, el Ara Solis y el monolito en homenaje
          a las víctimas del Prestige.
        </descripcion>
        <coordenadas>
          <longitud>-8.4050</longitud>
          <latitud>43.3845</latitud>
          <altitud>48</altitud>
        </coordenadas>
        <distanciaDesdeAnterior unidades="m">250</distanciaDesdeAnterior>
          <fotos>
            <foto>parque_escultorio.jpg</foto>
          </fotos>
      </hito>

      <hito orden="3">
        <nombre>Playa de Las Lapas</nombre>
        <descripcion>
          Pequeña cala de arena dorada situada en el extremo norte del paseo litoral,
          rodeada de acantilados que ofrecen protección del viento atlántico. Ideal
          para el baño en verano.
        </descripcion>
        <coordenadas>
          <longitud>-8.4120</longitud>
          <latitud>43.3820</latitud>
          <altitud>5</altitud>
        </coordenadas>
        <distanciaDesdeAnterior unidades="m">900</distanciaDesdeAnterior>
        <fotos>
          <foto>playa_de_las_lapas.jpg</foto>
        </fotos>  
        
      </hito>

      <hito orden="4">
        <nombre>Paseo Marítimo de La Coruña</nombre>
        <descripcion>
          Con más de 13 km de longitud, es uno de los paseos marítimos más largos
          de Europa. Bordea la costa atlántica desde el barrio de Os Mallos hasta
          Santa Cristina, con vistas continuas al mar y abundante vegetación.
        </descripcion>
        <coordenadas>
          <longitud>-8.4250</longitud>
          <latitud>43.3790</latitud>
          <altitud>8</altitud>
        </coordenadas>
        <distanciaDesdeAnterior unidades="m">1400</distanciaDesdeAnterior>
        <fotos>
          <foto>paseo_maritimo_de_la_coruna.jpg</foto>
        </fotos>
      </hito>

      <hito orden="5">
        <nombre>Playa de Riazor</nombre>
        <descripcion>
          Playa urbana de arena blanca y aguas limpias, una de las más populares
          de Galicia. Cuenta con servicios completos y es escenario habitual de
          competiciones deportivas de vóley playa y surf.
        </descripcion>
        <coordenadas>
          <longitud>-8.4350</longitud>
          <latitud>43.3680</latitud>
          <altitud>4</altitud>
        </coordenadas>
        <distanciaDesdeAnterior unidades="m">1800</distanciaDesdeAnterior>
          <fotos>
            <foto>playa_de_riazor.jpg</foto>
          </fotos>
      </hito>

      <hito orden="6">
        <nombre>Playa del Orzán</nombre>
        <descripcion>
          Contigua a Riazor, separada únicamente por el Paseo Marítimo, el Orzán
          es el epicentro del surf coruñés. Sus olas regulares la convierten en
          uno de los mejores spots de surf del norte de España.
        </descripcion>
        <coordenadas>
          <longitud>-8.4370</longitud>
          <latitud>43.3710</latitud>
          <altitud>4</altitud>
        </coordenadas>
        <distanciaDesdeAnterior unidades="m">400</distanciaDesdeAnterior>
        <fotos>
          <foto>playa_del_orzan.jpg</foto>
        </fotos>
      </hito>

    </hitos>
  </ruta>

  <!-- ============================================================
       RUTA 2: Ruta del Camino Inglés a Santiago de Compostela
       ============================================================ -->
  <ruta id="ruta002">
    <nombre>Ruta del Camino Inglés</nombre>
    <tipo>Senderismo</tipo>
    <transporte>A pie</transporte>
    <fechaInicio opcional="si">2025-07-01</fechaInicio>
    <horaInicio opcional="si">07:30</horaInicio>
    <duracion>2 días</duracion>
    <agencia>Caminos de Galicia</agencia>
    <descripcion>
      El Camino Inglés es la ruta jacobea que recorrían los peregrinos medievales
      procedentes de las Islas Británicas y el norte de Europa que llegaban en barco
      al puerto de La Coruña o Ferrol. Desde La Coruña, el trayecto recorre unos
      75 km hasta Santiago de Compostela atravesando paisajes rurales gallegos,
      aldeas históricas y tramos del antiguo camino romano.
    </descripcion>
    <personas>Personas en buena forma física. No recomendado para tercera edad sin entrenamiento previo.</personas>
    <lugarInicio>Obelisco de La Coruña</lugarInicio>
    <direccionInicio>Plaza de Pontevedra s/n, La Coruña</direccionInicio>
    <coordenadasInicio>
      <longitud>-8.4060</longitud>
      <latitud>43.3700</latitud>
      <altitud>15</altitud>
    </coordenadasInicio>
    <referencias>
      <referencia>https://www.caminodesantiago.gal/es/caminos/camino-ingles</referencia>
      <referencia>https://es.wikipedia.org/wiki/Camino_ingl%C3%A9s</referencia>
      <referencia>https://www.gronze.com/camino-ingles</referencia>
    </referencias>
    <recomendacion>8</recomendacion>
    <planimetria archivo="ruta002_planimetria.kml"/>
    <altimetria archivo="ruta002_altimetria.svg"/>
    <hitos>

      <hito orden="1">
        <nombre>Obelisco de La Coruña (Punto de inicio oficial)</nombre>
        <descripcion>
          Monumento neoclásico del siglo XIX situado en la plaza de Pontevedra.
          Es el punto oficial de inicio del Camino Inglés desde La Coruña, donde
          los peregrinos sellan por primera vez su credencial.
        </descripcion>
        <coordenadas>
          <longitud>-8.4060</longitud>
          <latitud>43.3700</latitud>
          <altitud>15</altitud>
        </coordenadas>
        <distanciaDesdeAnterior unidades="m">0</distanciaDesdeAnterior>
        <fotos>
          <foto>obelisco_de_la_coruña.jpg</foto>
        </fotos>
      </hito>

      <hito orden="2">
        <nombre>Iglesia de Santiago de Padrón</nombre>
        <descripcion>
          Iglesia románica del siglo XII que guarda, según la tradición, la barca
          de piedra que trajo los restos del apóstol Santiago desde Palestina.
          Situada a orillas del río Ulla, es uno de los lugares más sagrados
          del Camino Jacobeo.
        </descripcion>
        <coordenadas>
          <longitud>-8.6594</longitud>
          <latitud>42.7375</latitud>
          <altitud>10</altitud>
        </coordenadas>
        <distanciaDesdeAnterior unidades="km">38</distanciaDesdeAnterior>
        <fotos>
          <foto>iglesia_de_padron.jpg</foto>
        </fotos>
      </hito>

      <hito orden="3">
        <nombre>Monte Pedroso</nombre>
        <descripcion>
          Punto más elevado del tramo final del Camino Inglés, con vistas
          panorámicas de Santiago de Compostela. Desde aquí los peregrinos
          avistan por primera vez las torres de la catedral.
        </descripcion>
        <coordenadas>
          <longitud>-8.5450</longitud>
          <latitud>42.8820</latitud>
          <altitud>464</altitud>
        </coordenadas>
        <distanciaDesdeAnterior unidades="km">25</distanciaDesdeAnterior>
        <fotos>
          <foto>monte_pedroso.jpg</foto>
        </fotos>
      </hito>

      <hito orden="4">
        <nombre>Capilla de Santa Lucía (Entrada a Santiago)</nombre>
        <descripcion>
          Pequeña capilla del siglo XV que marca la entrada oficial al término
          municipal de Santiago de Compostela. Los peregrinos medievales hacían
          aquí su primera parada para dar gracias por haber llegado sanos y salvos.
        </descripcion>
        <coordenadas>
          <longitud>-8.5370</longitud>
          <latitud>42.8940</latitud>